Sheet: Sheet1
A1: 1
A2: of:=[.A1]+1 -> 2
A3: of:=[.A2]+1 -> 3
A4: of:=[.A3]+1 -> 4
A5: of:=[.A4]+1 -> 5
A6: of:=[.A5]+1 -> 6
A7: of:=[.A6]+1 -> 7
A8: of:=[.A7]+1 -> 8
A9: of:=[.A8]+1 -> 9
A10: of:=[.A9]+1 -> 10
A11: of:=[.A10]+1 -> 11
A12: of:=[.A11]+1 -> 12
A13: of:=[.A12]+1 -> 13
A14: of:=[.A13]+1 -> 14
A15: of:=[.A14]+1 -> 15
A16: of:=[.A15]+1 -> 16
A17: of:=[.A16]+1 -> 17
A18: of:=[.A17]+1 -> 18
A19: of:=[.A18]+1 -> 19
A20: of:=[.A19]+1 -> 20
A21: of:=[.A20]+1 -> 21
A22: of:=[.A21]+1 -> 22
A23: of:=[.A22]+1 -> 23
A24: of:=[.A23]+1 -> 24
A25: of:=[.A24]+1 -> 25
A26: of:=[.A25]+1 -> 26
A27: of:=[.A26]+1 -> 27
A28: of:=[.A27]+1 -> 28
A29: of:=[.A28]+1 -> 29
A30: of:=[.A29]+1 -> 30
A31: of:=[.A30]+1 -> 31
A32: of:=[.A31]+1 -> 32
A33: of:=[.A32]+1 -> 33
A34: of:=[.A33]+1 -> 34
A35: of:=[.A34]+1 -> 35
A36: of:=[.A35]+1 -> 36
A37: of:=[.A36]+1 -> 37
A38: of:=[.A37]+1 -> 38
A39: of:=[.A38]+1 -> 39
A40: of:=[.A39]+1 -> 40