Sheet: Sheet1
A1: Kahan Sum Function
A3: Result | B3: of:=[.B8] -> true
A7: Sheet | B7: Result | C7: Description
A8: 1 | B8: of:=[$Sheet2.C108] -> true | C8: Simple Kahan sum test with local references and values
B109: ZTEST Function
B111: Result | C111: true
B115: Sheet | C115: Result | D115: Description
B116: 1 | C116: true | D116: Simple ZTEST formulas with local references and values

Sheet: Sheet2
F2: SUM 1 | G2: SUM TRUE | H2: SUM 1 RAW | I2: SUM 2 | J2: SUM 2 RAW | L2: MATRIX DATA | O2: MATRIX DATA | S2: SUM3
F3: 1000000000000000 | G3: of:=IF(ABS([.F3])>1;0;[.F3]) -> 0 | H3: of:=[.F3] -> 1000000000000000 | I3: of:=IF(ABS([.F3])>1;[.F3]^9;[.F3]) -> 1E+135 | J3: of:=[.I3] -> 1E+135 | L3: of:=IF(ABS([.F3])>1;[.F3]^9;[.F3]) -> 1E+135 | M3: of:=IF(ABS([.F3])>1;[.F3]^9;[.F3]) -> 1E+135 | O3: of:=IF(ABS([.F3])>1;[.F3];[.F3]) -> 1000000000000000 | P3: of:=IF(ABS([.F3])>1;[.F3];[.F3]) -> 1000000000000000 | Q3: of:=IF(ABS([.F3])>1;[.F3];[.F3]) -> 1000000000000000 | S3: 1000000000000000
F4: 0.1 | G4: of:=IF(ABS([.F4])>1;0;[.F4]) -> 0.1 | H4: of:=[.F4]+[.H3] -> 1E+015 | I4: of:=IF(ABS([.F4])>1;[.F4]^9;[.F4]) -> 0.1 | J4: of:=[.I4]+[.J3] -> 1E+135 | L4: of:=IF(ABS([.F4])>1;[.F4]^9;[.F4]) -> 0.1 | M4: of:=IF(ABS([.F4])>1;[.F4]^9;[.F4]) -> 0.1 | O4: of:=IF(ABS([.F4])>1;[.F4];[.F4]) -> 0.1 | P4: of:=IF(ABS([.F4])>1;[.F4];[.F4]) -> 0.1 | Q4: of:=IF(ABS([.F4])>1;[.F4];[.F4]) -> 0.1 | S4: 1
F5: -1000000000000000 | G5: of:=IF(ABS([.F5])>1;0;[.F5]) -> 0 | H5: of:=[.F5]+[.H4] -> 0 | I5: of:=IF(ABS([.F5])>1;[.F5]^9;[.F5]) -> -1E+135 | J5: of:=[.I5]+[.J4] -> 0 | L5: of:=IF(ABS([.F5])>1;[.F5]^9;[.F5]) -> -1E+135 | M5: of:=IF(ABS([.F5])>1;[.F5]^9;[.F5]) -> -1E+135 | O5: of:=IF(ABS([.F5])>1;[.F5];[.F5]) -> -1000000000000000 | P5: of:=IF(ABS([.F5])>1;[.F5];[.F5]) -> -1000000000000000 | Q5: of:=IF(ABS([.F5])>1;[.F5];[.F5]) -> -1000000000000000 | S5: 1E-015
F6: 0.1 | G6: of:=IF(ABS([.F6])>1;0;[.F6]) -> 0.1 | H6: of:=[.F6]+[.H5] -> 0.1 | I6: of:=IF(ABS([.F6])>1;[.F6]^9;[.F6]) -> 0.1 | J6: of:=[.I6]+[.J5] -> 0.1 | L6: of:=IF(ABS([.F6])>1;[.F6]^9;[.F6]) -> 0.1 | M6: of:=IF(ABS([.F6])>1;[.F6]^9;[.F6]) -> 0.1 | O6: of:=IF(ABS([.F6])>1;[.F6];[.F6]) -> 0.1 | P6: of:=IF(ABS([.F6])>1;[.F6];[.F6]) -> 0.1 | Q6: of:=IF(ABS([.F6])>1;[.F6];[.F6]) -> 0.1 | S6: -1000000000000000
F7: 1000000000000000 | G7: of:=IF(ABS([.F7])>1;0;[.F7]) -> 0 | H7: of:=[.F7]+[.H6] -> 1E+015 | I7: of:=IF(ABS([.F7])>1;[.F7]^9;[.F7]) -> 1E+135 | J7: of:=[.I7]+[.J6] -> 1E+135 | L7: of:=IF(ABS([.F7])>1;[.F7]^9;[.F7]) -> 1E+135 | M7: of:=IF(ABS([.F7])>1;[.F7]^9;[.F7]) -> 1E+135 | O7: of:=IF(ABS([.F7])>1;[.F7];[.F7]) -> 1000000000000000 | P7: of:=IF(ABS([.F7])>1;[.F7];[.F7]) -> 1000000000000000 | Q7: of:=IF(ABS([.F7])>1;[.F7];[.F7]) -> 1000000000000000 | S7: -1
F8: 0.1 | G8: of:=IF(ABS([.F8])>1;0;[.F8]) -> 0.1 | H8: of:=[.F8]+[.H7] -> 1E+015 | I8: of:=IF(ABS([.F8])>1;[.F8]^9;[.F8]) -> 0.1 | J8: of:=[.I8]+[.J7] -> 1E+135 | L8: of:=IF(ABS([.F8])>1;[.F8]^9;[.F8]) -> 0.1 | M8: of:=IF(ABS([.F8])>1;[.F8]^9;[.F8]) -> 0.1 | O8: of:=IF(ABS([.F8])>1;[.F8];[.F8]) -> 0.1 | P8: of:=IF(ABS([.F8])>1;[.F8];[.F8]) -> 0.1 | Q8: of:=IF(ABS([.F8])>1;[.F8];[.F8]) -> 0.1 | S8: 1000000000000000
F9: -1000000000000000 | G9: of:=IF(ABS([.F9])>1;0;[.F9]) -> 0 | H9: of:=[.F9]+[.H8] -> 0 | I9: of:=IF(ABS([.F9])>1;[.F9]^9;[.F9]) -> -1E+135 | J9: of:=[.I9]+[.J8] -> 0 | L9: of:=IF(ABS([.F9])>1;[.F9]^9;[.F9]) -> -1E+135 | M9: of:=IF(ABS([.F9])>1;[.F9]^9;[.F9]) -> -1E+135 | O9: of:=IF(ABS([.F9])>1;[.F9];[.F9]) -> -1000000000000000 | P9: of:=IF(ABS([.F9])>1;[.F9];[.F9]) -> -1000000000000000 | Q9: of:=IF(ABS([.F9])>1;[.F9];[.F9]) -> -1000000000000000 | S9: 1
F10: 0.1 | G10: of:=IF(ABS([.F10])>1;0;[.F10]) -> 0.1 | H10: of:=[.F10]+[.H9] -> 0.1 | I10: of:=IF(ABS([.F10])>1;[.F10]^9;[.F10]) -> 0.1 | J10: of:=[.I10]+[.J9] -> 0.1 | L10: of:=IF(ABS([.F10])>1;[.F10]^9;[.F10]) -> 0.1 | M10: of:=IF(ABS([.F10])>1;[.F10]^9;[.F10]) -> 0.1 | O10: of:=IF(ABS([.F10])>1;[.F10];[.F10]) -> 0.1 | P10: of:=IF(ABS([.F10])>1;[.F10];[.F10]) -> 0.1 | Q10: of:=IF(ABS([.F10])>1;[.F10];[.F10]) -> 0.1 | S10: 1E-015
F11: 1000000000000000 | G11: of:=IF(ABS([.F11])>1;0;[.F11]) -> 0 | H11: of:=[.F11]+[.H10] -> 1E+015 | I11: of:=IF(ABS([.F11])>1;[.F11]^9;[.F11]) -> 1E+135 | J11: of:=[.I11]+[.J10] -> 1E+135 | L11: of:=IF(ABS([.F11])>1;[.F11]^9;[.F11]) -> 1E+135 | M11: of:=IF(ABS([.F11])>1;[.F11]^9;[.F11]) -> 1E+135 | O11: of:=IF(ABS([.F11])>1;[.F11];[.F11]) -> 1000000000000000 | P11: of:=IF(ABS([.F11])>1;[.F11];[.F11]) -> 1000000000000000 | Q11: of:=IF(ABS([.F11])>1;[.F11];[.F11]) -> 1000000000000000 | S11: -1000000000000000
F12: 0.1 | G12: of:=IF(ABS([.F12])>1;0;[.F12]) -> 0.1 | H12: of:=[.F12]+[.H11] -> 1E+015 | I12: of:=IF(ABS([.F12])>1;[.F12]^9;[.F12]) -> 0.1 | J12: of:=[.I12]+[.J11] -> 1E+135 | L12: of:=IF(ABS([.F12])>1;[.F12]^9;[.F12]) -> 0.1 | M12: of:=IF(ABS([.F12])>1;[.F12]^9;[.F12]) -> 0.1 | O12: of:=IF(ABS([.F12])>1;[.F12];[.F12]) -> 0.1 | P12: of:=IF(ABS([.F12])>1;[.F12];[.F12]) -> 0.1 | Q12: of:=IF(ABS([.F12])>1;[.F12];[.F12]) -> 0.1 | S12: -1
F13: -1000000000000000 | G13: of:=IF(ABS([.F13])>1;0;[.F13]) -> 0 | H13: of:=[.F13]+[.H12] -> 0 | I13: of:=IF(ABS([.F13])>1;[.F13]^9;[.F13]) -> -1E+135 | J13: of:=[.I13]+[.J12] -> 0 | L13: of:=IF(ABS([.F13])>1;[.F13]^9;[.F13]) -> -1E+135 | M13: of:=IF(ABS([.F13])>1;[.F13]^9;[.F13]) -> -1E+135 | O13: of:=IF(ABS([.F13])>1;[.F13];[.F13]) -> -1000000000000000 | P13: of:=IF(ABS([.F13])>1;[.F13];[.F13]) -> -1000000000000000 | Q13: of:=IF(ABS([.F13])>1;[.F13];[.F13]) -> -1000000000000000 | S13: 1000000000000000
F14: 0.1 | G14: of:=IF(ABS([.F14])>1;0;[.F14]) -> 0.1 | H14: of:=[.F14]+[.H13] -> 0.1 | I14: of:=IF(ABS([.F14])>1;[.F14]^9;[.F14]) -> 0.1 | J14: of:=[.I14]+[.J13] -> 0.1 | L14: of:=IF(ABS([.F14])>1;[.F14]^9;[.F14]) -> 0.1 | M14: of:=IF(ABS([.F14])>1;[.F14]^9;[.F14]) -> 0.1 | O14: of:=IF(ABS([.F14])>1;[.F14];[.F14]) -> 0.1 | P14: of:=IF(ABS([.F14])>1;[.F14];[.F14]) -> 0.1 | Q14: of:=IF(ABS([.F14])>1;[.F14];[.F14]) -> 0.1 | S14: 1
F15: 1000000000000000 | G15: of:=IF(ABS([.F15])>1;0;[.F15]) -> 0 | H15: of:=[.F15]+[.H14] -> 1E+015 | I15: of:=IF(ABS([.F15])>1;[.F15]^9;[.F15]) -> 1E+135 | J15: of:=[.I15]+[.J14] -> 1E+135 | L15: of:=IF(ABS([.F15])>1;[.F15]^9;[.F15]) -> 1E+135 | M15: of:=IF(ABS([.F15])>1;[.F15]^9;[.F15]) -> 1E+135 | O15: of:=IF(ABS([.F15])>1;[.F15];[.F15]) -> 1000000000000000 | P15: of:=IF(ABS([.F15])>1;[.F15];[.F15]) -> 1000000000000000 | Q15: of:=IF(ABS([.F15])>1;[.F15];[.F15]) -> 1000000000000000 | S15: 1E-015
F16: 0.1 | G16: of:=IF(ABS([.F16])>1;0;[.F16]) -> 0.1 | H16: of:=[.F16]+[.H15] -> 1E+015 | I16: of:=IF(ABS([.F16])>1;[.F16]^9;[.F16]) -> 0.1 | J16: of:=[.I16]+[.J15] -> 1E+135 | L16: of:=IF(ABS([.F16])>1;[.F16]^9;[.F16]) -> 0.1 | M16: of:=IF(ABS([.F16])>1;[.F16]^9;[.F16]) -> 0.1 | O16: of:=IF(ABS([.F16])>1;[.F16];[.F16]) -> 0.1 | P16: of:=IF(ABS([.F16])>1;[.F16];[.F16]) -> 0.1 | Q16: of:=IF(ABS([.F16])>1;[.F16];[.F16]) -> 0.1 | S16: -1000000000000000
F17: -1000000000000000 | G17: of:=IF(ABS([.F17])>1;0;[.F17]) -> 0 | H17: of:=[.F17]+[.H16] -> 0 | I17: of:=IF(ABS([.F17])>1;[.F17]^9;[.F17]) -> -1E+135 | J17: of:=[.I17]+[.J16] -> 0 | L17: of:=IF(ABS([.F17])>1;[.F17]^9;[.F17]) -> -1E+135 | M17: of:=IF(ABS([.F17])>1;[.F17]^9;[.F17]) -> -1E+135 | O17: of:=IF(ABS([.F17])>1;[.F17];[.F17]) -> -1000000000000000 | P17: of:=IF(ABS([.F17])>1;[.F17];[.F17]) -> -1000000000000000 | Q17: of:=IF(ABS([.F17])>1;[.F17];[.F17]) -> -1000000000000000 | S17: -1
F18: 0.1 | G18: of:=IF(ABS([.F18])>1;0;[.F18]) -> 0.1 | H18: of:=[.F18]+[.H17] -> 0.1 | I18: of:=IF(ABS([.F18])>1;[.F18]^9;[.F18]) -> 0.1 | J18: of:=[.I18]+[.J17] -> 0.1 | L18: of:=IF(ABS([.F18])>1;[.F18]^9;[.F18]) -> 0.1 | M18: of:=IF(ABS([.F18])>1;[.F18]^9;[.F18]) -> 0.1 | O18: of:=IF(ABS([.F18])>1;[.F18];[.F18]) -> 0.1 | P18: of:=IF(ABS([.F18])>1;[.F18];[.F18]) -> 0.1 | Q18: of:=IF(ABS([.F18])>1;[.F18];[.F18]) -> 0.1 | S18: 1000000000000000
F19: 1000000000000000 | G19: of:=IF(ABS([.F19])>1;0;[.F19]) -> 0 | H19: of:=[.F19]+[.H18] -> 1E+015 | I19: of:=IF(ABS([.F19])>1;[.F19]^9;[.F19]) -> 1E+135 | J19: of:=[.I19]+[.J18] -> 1E+135 | L19: of:=IF(ABS([.F19])>1;[.F19]^9;[.F19]) -> 1E+135 | M19: of:=IF(ABS([.F19])>1;[.F19]^9;[.F19]) -> 1E+135 | O19: of:=IF(ABS([.F19])>1;[.F19];[.F19]) -> 1000000000000000 | P19: of:=IF(ABS([.F19])>1;[.F19];[.F19]) -> 1000000000000000 | Q19: of:=IF(ABS([.F19])>1;[.F19];[.F19]) -> 1000000000000000 | S19: 1
F20: 0.1 | G20: of:=IF(ABS([.F20])>1;0;[.F20]) -> 0.1 | H20: of:=[.F20]+[.H19] -> 1E+015 | I20: of:=IF(ABS([.F20])>1;[.F20]^9;[.F20]) -> 0.1 | J20: of:=[.I20]+[.J19] -> 1E+135 | L20: of:=IF(ABS([.F20])>1;[.F20]^9;[.F20]) -> 0.1 | M20: of:=IF(ABS([.F20])>1;[.F20]^9;[.F20]) -> 0.1 | O20: of:=IF(ABS([.F20])>1;[.F20];[.F20]) -> 0.1 | P20: of:=IF(ABS([.F20])>1;[.F20];[.F20]) -> 0.1 | Q20: of:=IF(ABS([.F20])>1;[.F20];[.F20]) -> 0.1 | S20: 1E-015
F21: -1000000000000000 | G21: of:=IF(ABS([.F21])>1;0;[.F21]) -> 0 | H21: of:=[.F21]+[.H20] -> 0 | I21: of:=IF(ABS([.F21])>1;[.F21]^9;[.F21]) -> -1E+135 | J21: of:=[.I21]+[.J20] -> 0 | L21: of:=IF(ABS([.F21])>1;[.F21]^9;[.F21]) -> -1E+135 | M21: of:=IF(ABS([.F21])>1;[.F21]^9;[.F21]) -> -1E+135 | O21: of:=IF(ABS([.F21])>1;[.F21];[.F21]) -> -1000000000000000 | P21: of:=IF(ABS([.F21])>1;[.F21];[.F21]) -> -1000000000000000 | Q21: of:=IF(ABS([.F21])>1;[.F21];[.F21]) -> -1000000000000000 | S21: -1000000000000000
F22: 0.1 | G22: of:=IF(ABS([.F22])>1;0;[.F22]) -> 0.1 | H22: of:=[.F22]+[.H21] -> 0.1 | I22: of:=IF(ABS([.F22])>1;[.F22]^9;[.F22]) -> 0.1 | J22: of:=[.I22]+[.J21] -> 0.1 | L22: of:=IF(ABS([.F22])>1;[.F22]^9;[.F22]) -> 0.1 | M22: of:=IF(ABS([.F22])>1;[.F22]^9;[.F22]) -> 0.1 | O22: of:=IF(ABS([.F22])>1;[.F22];[.F22]) -> 0.1 | P22: of:=IF(ABS([.F22])>1;[.F22];[.F22]) -> 0.1 | Q22: of:=IF(ABS([.F22])>1;[.F22];[.F22]) -> 0.1 | S22: -1
F23: 1000000000000000 | G23: of:=IF(ABS([.F23])>1;0;[.F23]) -> 0 | H23: of:=[.F23]+[.H22] -> 1E+015 | I23: of:=IF(ABS([.F23])>1;[.F23]^9;[.F23]) -> 1E+135 | J23: of:=[.I23]+[.J22] -> 1E+135 | L23: of:=IF(ABS([.F23])>1;[.F23]^9;[.F23]) -> 1E+135 | M23: of:=IF(ABS([.F23])>1;[.F23]^9;[.F23]) -> 1E+135 | O23: of:=IF(ABS([.F23])>1;[.F23];[.F23]) -> 1000000000000000 | P23: of:=IF(ABS([.F23])>1;[.F23];[.F23]) -> 1000000000000000 | Q23: of:=IF(ABS([.F23])>1;[.F23];[.F23]) -> 1000000000000000 | S23: 1000000000000000
F24: 0.1 | G24: of:=IF(ABS([.F24])>1;0;[.F24]) -> 0.1 | H24: of:=[.F24]+[.H23] -> 1E+015 | I24: of:=IF(ABS([.F24])>1;[.F24]^9;[.F24]) -> 0.1 | J24: of:=[.I24]+[.J23] -> 1E+135 | L24: of:=IF(ABS([.F24])>1;[.F24]^9;[.F24]) -> 0.1 | M24: of:=IF(ABS([.F24])>1;[.F24]^9;[.F24]) -> 0.1 | O24: of:=IF(ABS([.F24])>1;[.F24];[.F24]) -> 0.1 | P24: of:=IF(ABS([.F24])>1;[.F24];[.F24]) -> 0.1 | Q24: of:=IF(ABS([.F24])>1;[.F24];[.F24]) -> 0.1 | S24: 1
F25: -1000000000000000 | G25: of:=IF(ABS([.F25])>1;0;[.F25]) -> 0 | H25: of:=[.F25]+[.H24] -> 0 | I25: of:=IF(ABS([.F25])>1;[.F25]^9;[.F25]) -> -1E+135 | J25: of:=[.I25]+[.J24] -> 0 | L25: of:=IF(ABS([.F25])>1;[.F25]^9;[.F25]) -> -1E+135 | M25: of:=IF(ABS([.F25])>1;[.F25]^9;[.F25]) -> -1E+135 | O25: of:=IF(ABS([.F25])>1;[.F25];[.F25]) -> -1000000000000000 | P25: of:=IF(ABS([.F25])>1;[.F25];[.F25]) -> -1000000000000000 | Q25: of:=IF(ABS([.F25])>1;[.F25];[.F25]) -> -1000000000000000 | S25: 1E-015
F26: 0.1 | G26: of:=IF(ABS([.F26])>1;0;[.F26]) -> 0.1 | H26: of:=[.F26]+[.H25] -> 0.1 | I26: of:=IF(ABS([.F26])>1;[.F26]^9;[.F26]) -> 0.1 | J26: of:=[.I26]+[.J25] -> 0.1 | L26: of:=IF(ABS([.F26])>1;[.F26]^9;[.F26]) -> 0.1 | M26: of:=IF(ABS([.F26])>1;[.F26]^9;[.F26]) -> 0.1 | O26: of:=IF(ABS([.F26])>1;[.F26];[.F26]) -> 0.1 | P26: of:=IF(ABS([.F26])>1;[.F26];[.F26]) -> 0.1 | Q26: of:=IF(ABS([.F26])>1;[.F26];[.F26]) -> 0.1 | S26: -1000000000000000
F27: 1000000000000000 | G27: of:=IF(ABS([.F27])>1;0;[.F27]) -> 0 | H27: of:=[.F27]+[.H26] -> 1E+015 | I27: of:=IF(ABS([.F27])>1;[.F27]^9;[.F27]) -> 1E+135 | J27: of:=[.I27]+[.J26] -> 1E+135 | L27: of:=IF(ABS([.F27])>1;[.F27]^9;[.F27]) -> 1E+135 | M27: of:=IF(ABS([.F27])>1;[.F27]^9;[.F27]) -> 1E+135 | O27: of:=IF(ABS([.F27])>1;[.F27];[.F27]) -> 1000000000000000 | P27: of:=IF(ABS([.F27])>1;[.F27];[.F27]) -> 1000000000000000 | Q27: of:=IF(ABS([.F27])>1;[.F27];[.F27]) -> 1000000000000000 | S27: -1
F28: 0.1 | G28: of:=IF(ABS([.F28])>1;0;[.F28]) -> 0.1 | H28: of:=[.F28]+[.H27] -> 1E+015 | I28: of:=IF(ABS([.F28])>1;[.F28]^9;[.F28]) -> 0.1 | J28: of:=[.I28]+[.J27] -> 1E+135 | L28: of:=IF(ABS([.F28])>1;[.F28]^9;[.F28]) -> 0.1 | M28: of:=IF(ABS([.F28])>1;[.F28]^9;[.F28]) -> 0.1 | O28: of:=IF(ABS([.F28])>1;[.F28];[.F28]) -> 0.1 | P28: of:=IF(ABS([.F28])>1;[.F28];[.F28]) -> 0.1 | Q28: of:=IF(ABS([.F28])>1;[.F28];[.F28]) -> 0.1 | S28: 1000000000000000
F29: -1000000000000000 | G29: of:=IF(ABS([.F29])>1;0;[.F29]) -> 0 | H29: of:=[.F29]+[.H28] -> 0 | I29: of:=IF(ABS([.F29])>1;[.F29]^9;[.F29]) -> -1E+135 | J29: of:=[.I29]+[.J28] -> 0 | L29: of:=IF(ABS([.F29])>1;[.F29]^9;[.F29]) -> -1E+135 | M29: of:=IF(ABS([.F29])>1;[.F29]^9;[.F29]) -> -1E+135 | O29: of:=IF(ABS([.F29])>1;[.F29];[.F29]) -> -1000000000000000 | P29: of:=IF(ABS([.F29])>1;[.F29];[.F29]) -> -1000000000000000 | Q29: of:=IF(ABS([.F29])>1;[.F29];[.F29]) -> -1000000000000000 | S29: 1
F30: 0.1 | G30: of:=IF(ABS([.F30])>1;0;[.F30]) -> 0.1 | H30: of:=[.F30]+[.H29] -> 0.1 | I30: of:=IF(ABS([.F30])>1;[.F30]^9;[.F30]) -> 0.1 | J30: of:=[.I30]+[.J29] -> 0.1 | L30: of:=IF(ABS([.F30])>1;[.F30]^9;[.F30]) -> 0.1 | M30: of:=IF(ABS([.F30])>1;[.F30]^9;[.F30]) -> 0.1 | O30: of:=IF(ABS([.F30])>1;[.F30];[.F30]) -> 0.1 | P30: of:=IF(ABS([.F30])>1;[.F30];[.F30]) -> 0.1 | Q30: of:=IF(ABS([.F30])>1;[.F30];[.F30]) -> 0.1 | S30: 1E-015
F31: 1000000000000000 | G31: of:=IF(ABS([.F31])>1;0;[.F31]) -> 0 | H31: of:=[.F31]+[.H30] -> 1E+015 | I31: of:=IF(ABS([.F31])>1;[.F31]^9;[.F31]) -> 1E+135 | J31: of:=[.I31]+[.J30] -> 1E+135 | L31: of:=IF(ABS([.F31])>1;[.F31]^9;[.F31]) -> 1E+135 | M31: of:=IF(ABS([.F31])>1;[.F31]^9;[.F31]) -> 1E+135 | O31: of:=IF(ABS([.F31])>1;[.F31];[.F31]) -> 1000000000000000 | P31: of:=IF(ABS([.F31])>1;[.F31];[.F31]) -> 1000000000000000 | Q31: of:=IF(ABS([.F31])>1;[.F31];[.F31]) -> 1000000000000000 | S31: -1000000000000000
F32: 0.1 | G32: of:=IF(ABS([.F32])>1;0;[.F32]) -> 0.1 | H32: of:=[.F32]+[.H31] -> 1E+015 | I32: of:=IF(ABS([.F32])>1;[.F32]^9;[.F32]) -> 0.1 | J32: of:=[.I32]+[.J31] -> 1E+135 | L32: of:=IF(ABS([.F32])>1;[.F32]^9;[.F32]) -> 0.1 | M32: of:=IF(ABS([.F32])>1;[.F32]^9;[.F32]) -> 0.1 | O32: of:=IF(ABS([.F32])>1;[.F32];[.F32]) -> 0.1 | P32: of:=IF(ABS([.F32])>1;[.F32];[.F32]) -> 0.1 | Q32: of:=IF(ABS([.F32])>1;[.F32];[.F32]) -> 0.1 | S32: -1
F33: -1000000000000000 | G33: of:=IF(ABS([.F33])>1;0;[.F33]) -> 0 | H33: of:=[.F33]+[.H32] -> 0 | I33: of:=IF(ABS([.F33])>1;[.F33]^9;[.F33]) -> -1E+135 | J33: of:=[.I33]+[.J32] -> 0 | L33: of:=IF(ABS([.F33])>1;[.F33]^9;[.F33]) -> -1E+135 | M33: of:=IF(ABS([.F33])>1;[.F33]^9;[.F33]) -> -1E+135 | O33: of:=IF(ABS([.F33])>1;[.F33];[.F33]) -> -1000000000000000 | P33: of:=IF(ABS([.F33])>1;[.F33];[.F33]) -> -1000000000000000 | Q33: of:=IF(ABS([.F33])>1;[.F33];[.F33]) -> -1000000000000000 | S33: 1000000000000000
F34: 0.1 | G34: of:=IF(ABS([.F34])>1;0;[.F34]) -> 0.1 | H34: of:=[.F34]+[.H33] -> 0.1 | I34: of:=IF(ABS([.F34])>1;[.F34]^9;[.F34]) -> 0.1 | J34: of:=[.I34]+[.J33] -> 0.1 | L34: of:=IF(ABS([.F34])>1;[.F34]^9;[.F34]) -> 0.1 | M34: of:=IF(ABS([.F34])>1;[.F34]^9;[.F34]) -> 0.1 | O34: of:=IF(ABS([.F34])>1;[.F34];[.F34]) -> 0.1 | P34: of:=IF(ABS([.F34])>1;[.F34];[.F34]) -> 0.1 | Q34: of:=IF(ABS([.F34])>1;[.F34];[.F34]) -> 0.1 | S34: 1
F35: 1000000000000000 | G35: of:=IF(ABS([.F35])>1;0;[.F35]) -> 0 | H35: of:=[.F35]+[.H34] -> 1E+015 | I35: of:=IF(ABS([.F35])>1;[.F35]^9;[.F35]) -> 1E+135 | J35: of:=[.I35]+[.J34] -> 1E+135 | L35: of:=IF(ABS([.F35])>1;[.F35]^9;[.F35]) -> 1E+135 | M35: of:=IF(ABS([.F35])>1;[.F35]^9;[.F35]) -> 1E+135 | O35: of:=IF(ABS([.F35])>1;[.F35];[.F35]) -> 1000000000000000 | P35: of:=IF(ABS([.F35])>1;[.F35];[.F35]) -> 1000000000000000 | Q35: of:=IF(ABS([.F35])>1;[.F35];[.F35]) -> 1000000000000000 | S35: 1E-015
F36: 0.1 | G36: of:=IF(ABS([.F36])>1;0;[.F36]) -> 0.1 | H36: of:=[.F36]+[.H35] -> 1E+015 | I36: of:=IF(ABS([.F36])>1;[.F36]^9;[.F36]) -> 0.1 | J36: of:=[.I36]+[.J35] -> 1E+135 | L36: of:=IF(ABS([.F36])>1;[.F36]^9;[.F36]) -> 0.1 | M36: of:=IF(ABS([.F36])>1;[.F36]^9;[.F36]) -> 0.1 | O36: of:=IF(ABS([.F36])>1;[.F36];[.F36]) -> 0.1 | P36: of:=IF(ABS([.F36])>1;[.F36];[.F36]) -> 0.1 | Q36: of:=IF(ABS([.F36])>1;[.F36];[.F36]) -> 0.1 | S36: -1000000000000000
F37: -1000000000000000 | G37: of:=IF(ABS([.F37])>1;0;[.F37]) -> 0 | H37: of:=[.F37]+[.H36] -> 0 | I37: of:=IF(ABS([.F37])>1;[.F37]^9;[.F37]) -> -1E+135 | J37: of:=[.I37]+[.J36] -> 0 | L37: of:=IF(ABS([.F37])>1;[.F37]^9;[.F37]) -> -1E+135 | M37: of:=IF(ABS([.F37])>1;[.F37]^9;[.F37]) -> -1E+135 | O37: of:=IF(ABS([.F37])>1;[.F37];[.F37]) -> -1000000000000000 | P37: of:=IF(ABS([.F37])>1;[.F37];[.F37]) -> -1000000000000000 | Q37: of:=IF(ABS([.F37])>1;[.F37];[.F37]) -> -1000000000000000 | S37: -1
F38: 0.1 | G38: of:=IF(ABS([.F38])>1;0;[.F38]) -> 0.1 | H38: of:=[.F38]+[.H37] -> 0.1 | I38: of:=IF(ABS([.F38])>1;[.F38]^9;[.F38]) -> 0.1 | J38: of:=[.I38]+[.J37] -> 0.1 | L38: of:=IF(ABS([.F38])>1;[.F38]^9;[.F38]) -> 0.1 | M38: of:=IF(ABS([.F38])>1;[.F38]^9;[.F38]) -> 0.1 | O38: of:=IF(ABS([.F38])>1;[.F38];[.F38]) -> 0.1 | P38: of:=IF(ABS([.F38])>1;[.F38];[.F38]) -> 0.1 | Q38: of:=IF(ABS([.F38])>1;[.F38];[.F38]) -> 0.1 | S38: 1000000000000000
F39: 1000000000000000 | G39: of:=IF(ABS([.F39])>1;0;[.F39]) -> 0 | H39: of:=[.F39]+[.H38] -> 1E+015 | I39: of:=IF(ABS([.F39])>1;[.F39]^9;[.F39]) -> 1E+135 | J39: of:=[.I39]+[.J38] -> 1E+135 | L39: of:=IF(ABS([.F39])>1;[.F39]^9;[.F39]) -> 1E+135 | M39: of:=IF(ABS([.F39])>1;[.F39]^9;[.F39]) -> 1E+135 | O39: of:=IF(ABS([.F39])>1;[.F39];[.F39]) -> 1000000000000000 | P39: of:=IF(ABS([.F39])>1;[.F39];[.F39]) -> 1000000000000000 | Q39: of:=IF(ABS([.F39])>1;[.F39];[.F39]) -> 1000000000000000 | S39: 1
F40: 0.1 | G40: of:=IF(ABS([.F40])>1;0;[.F40]) -> 0.1 | H40: of:=[.F40]+[.H39] -> 1E+015 | I40: of:=IF(ABS([.F40])>1;[.F40]^9;[.F40]) -> 0.1 | J40: of:=[.I40]+[.J39] -> 1E+135 | L40: of:=IF(ABS([.F40])>1;[.F40]^9;[.F40]) -> 0.1 | M40: of:=IF(ABS([.F40])>1;[.F40]^9;[.F40]) -> 0.1 | O40: of:=IF(ABS([.F40])>1;[.F40];[.F40]) -> 0.1 | P40: of:=IF(ABS([.F40])>1;[.F40];[.F40]) -> 0.1 | Q40: of:=IF(ABS([.F40])>1;[.F40];[.F40]) -> 0.1 | S40: 1E-015
F41: -1000000000000000 | G41: of:=IF(ABS([.F41])>1;0;[.F41]) -> 0 | H41: of:=[.F41]+[.H40] -> 0 | I41: of:=IF(ABS([.F41])>1;[.F41]^9;[.F41]) -> -1E+135 | J41: of:=[.I41]+[.J40] -> 0 | L41: of:=IF(ABS([.F41])>1;[.F41]^9;[.F41]) -> -1E+135 | M41: of:=IF(ABS([.F41])>1;[.F41]^9;[.F41]) -> -1E+135 | O41: of:=IF(ABS([.F41])>1;[.F41];[.F41]) -> -1000000000000000 | P41: of:=IF(ABS([.F41])>1;[.F41];[.F41]) -> -1000000000000000 | Q41: of:=IF(ABS([.F41])>1;[.F41];[.F41]) -> -1000000000000000 | S41: -1000000000000000
F42: 0.1 | G42: of:=IF(ABS([.F42])>1;0;[.F42]) -> 0.1 | H42: of:=[.F42]+[.H41] -> 0.1 | I42: of:=IF(ABS([.F42])>1;[.F42]^9;[.F42]) -> 0.1 | J42: of:=[.I42]+[.J41] -> 0.1 | L42: of:=IF(ABS([.F42])>1;[.F42]^9;[.F42]) -> 0.1 | M42: of:=IF(ABS([.F42])>1;[.F42]^9;[.F42]) -> 0.1 | O42: of:=IF(ABS([.F42])>1;[.F42];[.F42]) -> 0.1 | P42: of:=IF(ABS([.F42])>1;[.F42];[.F42]) -> 0.1 | Q42: of:=IF(ABS([.F42])>1;[.F42];[.F42]) -> 0.1 | S42: -1
F43: 1000000000000000 | G43: of:=IF(ABS([.F43])>1;0;[.F43]) -> 0 | H43: of:=[.F43]+[.H42] -> 1E+015 | I43: of:=IF(ABS([.F43])>1;[.F43]^9;[.F43]) -> 1E+135 | J43: of:=[.I43]+[.J42] -> 1E+135 | L43: of:=IF(ABS([.F43])>1;[.F43]^9;[.F43]) -> 1E+135 | M43: of:=IF(ABS([.F43])>1;[.F43]^9;[.F43]) -> 1E+135 | O43: of:=IF(ABS([.F43])>1;[.F43];[.F43]) -> 1000000000000000 | P43: of:=IF(ABS([.F43])>1;[.F43];[.F43]) -> 1000000000000000 | Q43: of:=IF(ABS([.F43])>1;[.F43];[.F43]) -> 1000000000000000 | S43: 1000000000000000
F44: 0.1 | G44: of:=IF(ABS([.F44])>1;0;[.F44]) -> 0.1 | H44: of:=[.F44]+[.H43] -> 1E+015 | I44: of:=IF(ABS([.F44])>1;[.F44]^9;[.F44]) -> 0.1 | J44: of:=[.I44]+[.J43] -> 1E+135 | L44: of:=IF(ABS([.F44])>1;[.F44]^9;[.F44]) -> 0.1 | M44: of:=IF(ABS([.F44])>1;[.F44]^9;[.F44]) -> 0.1 | O44: of:=IF(ABS([.F44])>1;[.F44];[.F44]) -> 0.1 | P44: of:=IF(ABS([.F44])>1;[.F44];[.F44]) -> 0.1 | Q44: of:=IF(ABS([.F44])>1;[.F44];[.F44]) -> 0.1 | S44: 1
F45: -1000000000000000 | G45: of:=IF(ABS([.F45])>1;0;[.F45]) -> 0 | H45: of:=[.F45]+[.H44] -> 0 | I45: of:=IF(ABS([.F45])>1;[.F45]^9;[.F45]) -> -1E+135 | J45: of:=[.I45]+[.J44] -> 0 | L45: of:=IF(ABS([.F45])>1;[.F45]^9;[.F45]) -> -1E+135 | M45: of:=IF(ABS([.F45])>1;[.F45]^9;[.F45]) -> -1E+135 | O45: of:=IF(ABS([.F45])>1;[.F45];[.F45]) -> -1000000000000000 | P45: of:=IF(ABS([.F45])>1;[.F45];[.F45]) -> -1000000000000000 | Q45: of:=IF(ABS([.F45])>1;[.F45];[.F45]) -> -1000000000000000 | S45: 1E-015
F46: 0.1 | G46: of:=IF(ABS([.F46])>1;0;[.F46]) -> 0.1 | H46: of:=[.F46]+[.H45] -> 0.1 | I46: of:=IF(ABS([.F46])>1;[.F46]^9;[.F46]) -> 0.1 | J46: of:=[.I46]+[.J45] -> 0.1 | L46: of:=IF(ABS([.F46])>1;[.F46]^9;[.F46]) -> 0.1 | M46: of:=IF(ABS([.F46])>1;[.F46]^9;[.F46]) -> 0.1 | O46: of:=IF(ABS([.F46])>1;[.F46];[.F46]) -> 0.1 | P46: of:=IF(ABS([.F46])>1;[.F46];[.F46]) -> 0.1 | Q46: of:=IF(ABS([.F46])>1;[.F46];[.F46]) -> 0.1 | S46: -1000000000000000
F47: 1000000000000000 | G47: of:=IF(ABS([.F47])>1;0;[.F47]) -> 0 | H47: of:=[.F47]+[.H46] -> 1E+015 | I47: of:=IF(ABS([.F47])>1;[.F47]^9;[.F47]) -> 1E+135 | J47: of:=[.I47]+[.J46] -> 1E+135 | L47: of:=IF(ABS([.F47])>1;[.F47]^9;[.F47]) -> 1E+135 | M47: of:=IF(ABS([.F47])>1;[.F47]^9;[.F47]) -> 1E+135 | O47: of:=IF(ABS([.F47])>1;[.F47];[.F47]) -> 1000000000000000 | P47: of:=IF(ABS([.F47])>1;[.F47];[.F47]) -> 1000000000000000 | Q47: of:=IF(ABS([.F47])>1;[.F47];[.F47]) -> 1000000000000000 | S47: -1
F48: 0.1 | G48: of:=IF(ABS([.F48])>1;0;[.F48]) -> 0.1 | H48: of:=[.F48]+[.H47] -> 1E+015 | I48: of:=IF(ABS([.F48])>1;[.F48]^9;[.F48]) -> 0.1 | J48: of:=[.I48]+[.J47] -> 1E+135 | L48: of:=IF(ABS([.F48])>1;[.F48]^9;[.F48]) -> 0.1 | M48: of:=IF(ABS([.F48])>1;[.F48]^9;[.F48]) -> 0.1 | O48: of:=IF(ABS([.F48])>1;[.F48];[.F48]) -> 0.1 | P48: of:=IF(ABS([.F48])>1;[.F48];[.F48]) -> 0.1 | Q48: of:=IF(ABS([.F48])>1;[.F48];[.F48]) -> 0.1 | S48: 1000000000000000
F49: -1000000000000000 | G49: of:=IF(ABS([.F49])>1;0;[.F49]) -> 0 | H49: of:=[.F49]+[.H48] -> 0 | I49: of:=IF(ABS([.F49])>1;[.F49]^9;[.F49]) -> -1E+135 | J49: of:=[.I49]+[.J48] -> 0 | L49: of:=IF(ABS([.F49])>1;[.F49]^9;[.F49]) -> -1E+135 | M49: of:=IF(ABS([.F49])>1;[.F49]^9;[.F49]) -> -1E+135 | O49: of:=IF(ABS([.F49])>1;[.F49];[.F49]) -> -1000000000000000 | P49: of:=IF(ABS([.F49])>1;[.F49];[.F49]) -> -1000000000000000 | Q49: of:=IF(ABS([.F49])>1;[.F49];[.F49]) -> -1000000000000000 | S49: 1
F50: 0.1 | G50: of:=IF(ABS([.F50])>1;0;[.F50]) -> 0.1 | H50: of:=[.F50]+[.H49] -> 0.1 | I50: of:=IF(ABS([.F50])>1;[.F50]^9;[.F50]) -> 0.1 | J50: of:=[.I50]+[.J49] -> 0.1 | L50: of:=IF(ABS([.F50])>1;[.F50]^9;[.F50]) -> 0.1 | M50: of:=IF(ABS([.F50])>1;[.F50]^9;[.F50]) -> 0.1 | O50: of:=IF(ABS([.F50])>1;[.F50];[.F50]) -> 0.1 | P50: of:=IF(ABS([.F50])>1;[.F50];[.F50]) -> 0.1 | Q50: of:=IF(ABS([.F50])>1;[.F50];[.F50]) -> 0.1 | S50: 1E-015
F51: 1000000000000000 | G51: of:=IF(ABS([.F51])>1;0;[.F51]) -> 0 | H51: of:=[.F51]+[.H50] -> 1E+015 | I51: of:=IF(ABS([.F51])>1;[.F51]^9;[.F51]) -> 1E+135 | J51: of:=[.I51]+[.J50] -> 1E+135 | L51: of:=IF(ABS([.F51])>1;[.F51]^9;[.F51]) -> 1E+135 | M51: of:=IF(ABS([.F51])>1;[.F51]^9;[.F51]) -> 1E+135 | O51: of:=IF(ABS([.F51])>1;[.F51];[.F51]) -> 1000000000000000 | P51: of:=IF(ABS([.F51])>1;[.F51];[.F51]) -> 1000000000000000 | Q51: of:=IF(ABS([.F51])>1;[.F51];[.F51]) -> 1000000000000000 | S51: -1000000000000000
F52: 0.1 | G52: of:=IF(ABS([.F52])>1;0;[.F52]) -> 0.1 | H52: of:=[.F52]+[.H51] -> 1E+015 | I52: of:=IF(ABS([.F52])>1;[.F52]^9;[.F52]) -> 0.1 | J52: of:=[.I52]+[.J51] -> 1E+135 | L52: of:=IF(ABS([.F52])>1;[.F52]^9;[.F52]) -> 0.1 | M52: of:=IF(ABS([.F52])>1;[.F52]^9;[.F52]) -> 0.1 | O52: of:=IF(ABS([.F52])>1;[.F52];[.F52]) -> 0.1 | P52: of:=IF(ABS([.F52])>1;[.F52];[.F52]) -> 0.1 | Q52: of:=IF(ABS([.F52])>1;[.F52];[.F52]) -> 0.1 | S52: -1
F53: -1000000000000000 | G53: of:=IF(ABS([.F53])>1;0;[.F53]) -> 0 | H53: of:=[.F53]+[.H52] -> 0 | I53: of:=IF(ABS([.F53])>1;[.F53]^9;[.F53]) -> -1E+135 | J53: of:=[.I53]+[.J52] -> 0 | L53: of:=IF(ABS([.F53])>1;[.F53]^9;[.F53]) -> -1E+135 | M53: of:=IF(ABS([.F53])>1;[.F53]^9;[.F53]) -> -1E+135 | O53: of:=IF(ABS([.F53])>1;[.F53];[.F53]) -> -1000000000000000 | P53: of:=IF(ABS([.F53])>1;[.F53];[.F53]) -> -1000000000000000 | Q53: of:=IF(ABS([.F53])>1;[.F53];[.F53]) -> -1000000000000000 | S53: 1000000000000000
F54: 0.1 | G54: of:=IF(ABS([.F54])>1;0;[.F54]) -> 0.1 | H54: of:=[.F54]+[.H53] -> 0.1 | I54: of:=IF(ABS([.F54])>1;[.F54]^9;[.F54]) -> 0.1 | J54: of:=[.I54]+[.J53] -> 0.1 | L54: of:=IF(ABS([.F54])>1;[.F54]^9;[.F54]) -> 0.1 | M54: of:=IF(ABS([.F54])>1;[.F54]^9;[.F54]) -> 0.1 | O54: of:=IF(ABS([.F54])>1;[.F54];[.F54]) -> 0.1 | P54: of:=IF(ABS([.F54])>1;[.F54];[.F54]) -> 0.1 | Q54: of:=IF(ABS([.F54])>1;[.F54];[.F54]) -> 0.1 | S54: 1
F55: 1000000000000000 | G55: of:=IF(ABS([.F55])>1;0;[.F55]) -> 0 | H55: of:=[.F55]+[.H54] -> 1E+015 | I55: of:=IF(ABS([.F55])>1;[.F55]^9;[.F55]) -> 1E+135 | J55: of:=[.I55]+[.J54] -> 1E+135 | L55: of:=IF(ABS([.F55])>1;[.F55]^9;[.F55]) -> 1E+135 | M55: of:=IF(ABS([.F55])>1;[.F55]^9;[.F55]) -> 1E+135 | O55: of:=IF(ABS([.F55])>1;[.F55];[.F55]) -> 1000000000000000 | P55: of:=IF(ABS([.F55])>1;[.F55];[.F55]) -> 1000000000000000 | Q55: of:=IF(ABS([.F55])>1;[.F55];[.F55]) -> 1000000000000000 | S55: 1E-015
F56: 0.1 | G56: of:=IF(ABS([.F56])>1;0;[.F56]) -> 0.1 | H56: of:=[.F56]+[.H55] -> 1E+015 | I56: of:=IF(ABS([.F56])>1;[.F56]^9;[.F56]) -> 0.1 | J56: of:=[.I56]+[.J55] -> 1E+135 | L56: of:=IF(ABS([.F56])>1;[.F56]^9;[.F56]) -> 0.1 | M56: of:=IF(ABS([.F56])>1;[.F56]^9;[.F56]) -> 0.1 | O56: of:=IF(ABS([.F56])>1;[.F56];[.F56]) -> 0.1 | P56: of:=IF(ABS([.F56])>1;[.F56];[.F56]) -> 0.1 | Q56: of:=IF(ABS([.F56])>1;[.F56];[.F56]) -> 0.1 | S56: -1000000000000000
F57: -1000000000000000 | G57: of:=IF(ABS([.F57])>1;0;[.F57]) -> 0 | H57: of:=[.F57]+[.H56] -> 0 | I57: of:=IF(ABS([.F57])>1;[.F57]^9;[.F57]) -> -1E+135 | J57: of:=[.I57]+[.J56] -> 0 | L57: of:=IF(ABS([.F57])>1;[.F57]^9;[.F57]) -> -1E+135 | M57: of:=IF(ABS([.F57])>1;[.F57]^9;[.F57]) -> -1E+135 | O57: of:=IF(ABS([.F57])>1;[.F57];[.F57]) -> -1000000000000000 | P57: of:=IF(ABS([.F57])>1;[.F57];[.F57]) -> -1000000000000000 | Q57: of:=IF(ABS([.F57])>1;[.F57];[.F57]) -> -1000000000000000 | S57: -1
F58: 0.1 | G58: of:=IF(ABS([.F58])>1;0;[.F58]) -> 0.1 | H58: of:=[.F58]+[.H57] -> 0.1 | I58: of:=IF(ABS([.F58])>1;[.F58]^9;[.F58]) -> 0.1 | J58: of:=[.I58]+[.J57] -> 0.1 | L58: of:=IF(ABS([.F58])>1;[.F58]^9;[.F58]) -> 0.1 | M58: of:=IF(ABS([.F58])>1;[.F58]^9;[.F58]) -> 0.1 | O58: of:=IF(ABS([.F58])>1;[.F58];[.F58]) -> 0.1 | P58: of:=IF(ABS([.F58])>1;[.F58];[.F58]) -> 0.1 | Q58: of:=IF(ABS([.F58])>1;[.F58];[.F58]) -> 0.1 | S58: 1000000000000000
F59: 1000000000000000 | G59: of:=IF(ABS([.F59])>1;0;[.F59]) -> 0 | H59: of:=[.F59]+[.H58] -> 1E+015 | I59: of:=IF(ABS([.F59])>1;[.F59]^9;[.F59]) -> 1E+135 | J59: of:=[.I59]+[.J58] -> 1E+135 | L59: of:=IF(ABS([.F59])>1;[.F59]^9;[.F59]) -> 1E+135 | M59: of:=IF(ABS([.F59])>1;[.F59]^9;[.F59]) -> 1E+135 | O59: of:=IF(ABS([.F59])>1;[.F59];[.F59]) -> 1000000000000000 | P59: of:=IF(ABS([.F59])>1;[.F59];[.F59]) -> 1000000000000000 | Q59: of:=IF(ABS([.F59])>1;[.F59];[.F59]) -> 1000000000000000 | S59: 1
F60: 0.1 | G60: of:=IF(ABS([.F60])>1;0;[.F60]) -> 0.1 | H60: of:=[.F60]+[.H59] -> 1E+015 | I60: of:=IF(ABS([.F60])>1;[.F60]^9;[.F60]) -> 0.1 | J60: of:=[.I60]+[.J59] -> 1E+135 | L60: of:=IF(ABS([.F60])>1;[.F60]^9;[.F60]) -> 0.1 | M60: of:=IF(ABS([.F60])>1;[.F60]^9;[.F60]) -> 0.1 | O60: of:=IF(ABS([.F60])>1;[.F60];[.F60]) -> 0.1 | P60: of:=IF(ABS([.F60])>1;[.F60];[.F60]) -> 0.1 | Q60: of:=IF(ABS([.F60])>1;[.F60];[.F60]) -> 0.1 | S60: 1E-015
F61: -1000000000000000 | G61: of:=IF(ABS([.F61])>1;0;[.F61]) -> 0 | H61: of:=[.F61]+[.H60] -> 0 | I61: of:=IF(ABS([.F61])>1;[.F61]^9;[.F61]) -> -1E+135 | J61: of:=[.I61]+[.J60] -> 0 | L61: of:=IF(ABS([.F61])>1;[.F61]^9;[.F61]) -> -1E+135 | M61: of:=IF(ABS([.F61])>1;[.F61]^9;[.F61]) -> -1E+135 | O61: of:=IF(ABS([.F61])>1;[.F61];[.F61]) -> -1000000000000000 | P61: of:=IF(ABS([.F61])>1;[.F61];[.F61]) -> -1000000000000000 | Q61: of:=IF(ABS([.F61])>1;[.F61];[.F61]) -> -1000000000000000 | S61: -1000000000000000
F62: 0.1 | G62: of:=IF(ABS([.F62])>1;0;[.F62]) -> 0.1 | H62: of:=[.F62]+[.H61] -> 0.1 | I62: of:=IF(ABS([.F62])>1;[.F62]^9;[.F62]) -> 0.1 | J62: of:=[.I62]+[.J61] -> 0.1 | L62: of:=IF(ABS([.F62])>1;[.F62]^9;[.F62]) -> 0.1 | M62: of:=IF(ABS([.F62])>1;[.F62]^9;[.F62]) -> 0.1 | O62: of:=IF(ABS([.F62])>1;[.F62];[.F62]) -> 0.1 | P62: of:=IF(ABS([.F62])>1;[.F62];[.F62]) -> 0.1 | Q62: of:=IF(ABS([.F62])>1;[.F62];[.F62]) -> 0.1 | S62: -1
F63: 1000000000000000 | G63: of:=IF(ABS([.F63])>1;0;[.F63]) -> 0 | H63: of:=[.F63]+[.H62] -> 1E+015 | I63: of:=IF(ABS([.F63])>1;[.F63]^9;[.F63]) -> 1E+135 | J63: of:=[.I63]+[.J62] -> 1E+135 | L63: of:=IF(ABS([.F63])>1;[.F63]^9;[.F63]) -> 1E+135 | M63: of:=IF(ABS([.F63])>1;[.F63]^9;[.F63]) -> 1E+135 | O63: of:=IF(ABS([.F63])>1;[.F63];[.F63]) -> 1000000000000000 | P63: of:=IF(ABS([.F63])>1;[.F63];[.F63]) -> 1000000000000000 | Q63: of:=IF(ABS([.F63])>1;[.F63];[.F63]) -> 1000000000000000 | S63: 1000000000000000
F64: 0.1 | G64: of:=IF(ABS([.F64])>1;0;[.F64]) -> 0.1 | H64: of:=[.F64]+[.H63] -> 1E+015 | I64: of:=IF(ABS([.F64])>1;[.F64]^9;[.F64]) -> 0.1 | J64: of:=[.I64]+[.J63] -> 1E+135 | L64: of:=IF(ABS([.F64])>1;[.F64]^9;[.F64]) -> 0.1 | M64: of:=IF(ABS([.F64])>1;[.F64]^9;[.F64]) -> 0.1 | O64: of:=IF(ABS([.F64])>1;[.F64];[.F64]) -> 0.1 | P64: of:=IF(ABS([.F64])>1;[.F64];[.F64]) -> 0.1 | Q64: of:=IF(ABS([.F64])>1;[.F64];[.F64]) -> 0.1 | S64: 1
F65: -1000000000000000 | G65: of:=IF(ABS([.F65])>1;0;[.F65]) -> 0 | H65: of:=[.F65]+[.H64] -> 0 | I65: of:=IF(ABS([.F65])>1;[.F65]^9;[.F65]) -> -1E+135 | J65: of:=[.I65]+[.J64] -> 0 | L65: of:=IF(ABS([.F65])>1;[.F65]^9;[.F65]) -> -1E+135 | M65: of:=IF(ABS([.F65])>1;[.F65]^9;[.F65]) -> -1E+135 | O65: of:=IF(ABS([.F65])>1;[.F65];[.F65]) -> -1000000000000000 | P65: of:=IF(ABS([.F65])>1;[.F65];[.F65]) -> -1000000000000000 | Q65: of:=IF(ABS([.F65])>1;[.F65];[.F65]) -> -1000000000000000 | S65: 1E-015
F66: 0.1 | G66: of:=IF(ABS([.F66])>1;0;[.F66]) -> 0.1 | H66: of:=[.F66]+[.H65] -> 0.1 | I66: of:=IF(ABS([.F66])>1;[.F66]^9;[.F66]) -> 0.1 | J66: of:=[.I66]+[.J65] -> 0.1 | L66: of:=IF(ABS([.F66])>1;[.F66]^9;[.F66]) -> 0.1 | M66: of:=IF(ABS([.F66])>1;[.F66]^9;[.F66]) -> 0.1 | O66: of:=IF(ABS([.F66])>1;[.F66];[.F66]) -> 0.1 | P66: of:=IF(ABS([.F66])>1;[.F66];[.F66]) -> 0.1 | Q66: of:=IF(ABS([.F66])>1;[.F66];[.F66]) -> 0.1 | S66: -1000000000000000
F67: 1000000000000000 | G67: of:=IF(ABS([.F67])>1;0;[.F67]) -> 0 | H67: of:=[.F67]+[.H66] -> 1E+015 | I67: of:=IF(ABS([.F67])>1;[.F67]^9;[.F67]) -> 1E+135 | J67: of:=[.I67]+[.J66] -> 1E+135 | L67: of:=IF(ABS([.F67])>1;[.F67]^9;[.F67]) -> 1E+135 | M67: of:=IF(ABS([.F67])>1;[.F67]^9;[.F67]) -> 1E+135 | O67: of:=IF(ABS([.F67])>1;[.F67];[.F67]) -> 1000000000000000 | P67: of:=IF(ABS([.F67])>1;[.F67];[.F67]) -> 1000000000000000 | Q67: of:=IF(ABS([.F67])>1;[.F67];[.F67]) -> 1000000000000000 | S67: -1
F68: 0.1 | G68: of:=IF(ABS([.F68])>1;0;[.F68]) -> 0.1 | H68: of:=[.F68]+[.H67] -> 1E+015 | I68: of:=IF(ABS([.F68])>1;[.F68]^9;[.F68]) -> 0.1 | J68: of:=[.I68]+[.J67] -> 1E+135 | L68: of:=IF(ABS([.F68])>1;[.F68]^9;[.F68]) -> 0.1 | M68: of:=IF(ABS([.F68])>1;[.F68]^9;[.F68]) -> 0.1 | O68: of:=IF(ABS([.F68])>1;[.F68];[.F68]) -> 0.1 | P68: of:=IF(ABS([.F68])>1;[.F68];[.F68]) -> 0.1 | Q68: of:=IF(ABS([.F68])>1;[.F68];[.F68]) -> 0.1 | S68: 1000000000000000
F69: -1000000000000000 | G69: of:=IF(ABS([.F69])>1;0;[.F69]) -> 0 | H69: of:=[.F69]+[.H68] -> 0 | I69: of:=IF(ABS([.F69])>1;[.F69]^9;[.F69]) -> -1E+135 | J69: of:=[.I69]+[.J68] -> 0 | L69: of:=IF(ABS([.F69])>1;[.F69]^9;[.F69]) -> -1E+135 | M69: of:=IF(ABS([.F69])>1;[.F69]^9;[.F69]) -> -1E+135 | O69: of:=IF(ABS([.F69])>1;[.F69];[.F69]) -> -1000000000000000 | P69: of:=IF(ABS([.F69])>1;[.F69];[.F69]) -> -1000000000000000 | Q69: of:=IF(ABS([.F69])>1;[.F69];[.F69]) -> -1000000000000000 | S69: 1
F70: 0.1 | G70: of:=IF(ABS([.F70])>1;0;[.F70]) -> 0.1 | H70: of:=[.F70]+[.H69] -> 0.1 | I70: of:=IF(ABS([.F70])>1;[.F70]^9;[.F70]) -> 0.1 | J70: of:=[.I70]+[.J69] -> 0.1 | L70: of:=IF(ABS([.F70])>1;[.F70]^9;[.F70]) -> 0.1 | M70: of:=IF(ABS([.F70])>1;[.F70]^9;[.F70]) -> 0.1 | O70: of:=IF(ABS([.F70])>1;[.F70];[.F70]) -> 0.1 | P70: of:=IF(ABS([.F70])>1;[.F70];[.F70]) -> 0.1 | Q70: of:=IF(ABS([.F70])>1;[.F70];[.F70]) -> 0.1 | S70: 1E-015
F71: 1000000000000000 | G71: of:=IF(ABS([.F71])>1;0;[.F71]) -> 0 | H71: of:=[.F71]+[.H70] -> 1E+015 | I71: of:=IF(ABS([.F71])>1;[.F71]^9;[.F71]) -> 1E+135 | J71: of:=[.I71]+[.J70] -> 1E+135 | L71: of:=IF(ABS([.F71])>1;[.F71]^9;[.F71]) -> 1E+135 | M71: of:=IF(ABS([.F71])>1;[.F71]^9;[.F71]) -> 1E+135 | O71: of:=IF(ABS([.F71])>1;[.F71];[.F71]) -> 1000000000000000 | P71: of:=IF(ABS([.F71])>1;[.F71];[.F71]) -> 1000000000000000 | Q71: of:=IF(ABS([.F71])>1;[.F71];[.F71]) -> 1000000000000000 | S71: -1000000000000000
F72: 0.1 | G72: of:=IF(ABS([.F72])>1;0;[.F72]) -> 0.1 | H72: of:=[.F72]+[.H71] -> 1E+015 | I72: of:=IF(ABS([.F72])>1;[.F72]^9;[.F72]) -> 0.1 | J72: of:=[.I72]+[.J71] -> 1E+135 | L72: of:=IF(ABS([.F72])>1;[.F72]^9;[.F72]) -> 0.1 | M72: of:=IF(ABS([.F72])>1;[.F72]^9;[.F72]) -> 0.1 | O72: of:=IF(ABS([.F72])>1;[.F72];[.F72]) -> 0.1 | P72: of:=IF(ABS([.F72])>1;[.F72];[.F72]) -> 0.1 | Q72: of:=IF(ABS([.F72])>1;[.F72];[.F72]) -> 0.1 | S72: -1
F73: -1000000000000000 | G73: of:=IF(ABS([.F73])>1;0;[.F73]) -> 0 | H73: of:=[.F73]+[.H72] -> 0 | I73: of:=IF(ABS([.F73])>1;[.F73]^9;[.F73]) -> -1E+135 | J73: of:=[.I73]+[.J72] -> 0 | L73: of:=IF(ABS([.F73])>1;[.F73]^9;[.F73]) -> -1E+135 | M73: of:=IF(ABS([.F73])>1;[.F73]^9;[.F73]) -> -1E+135 | O73: of:=IF(ABS([.F73])>1;[.F73];[.F73]) -> -1000000000000000 | P73: of:=IF(ABS([.F73])>1;[.F73];[.F73]) -> -1000000000000000 | Q73: of:=IF(ABS([.F73])>1;[.F73];[.F73]) -> -1000000000000000 | S73: 1000000000000000
F74: 0.1 | G74: of:=IF(ABS([.F74])>1;0;[.F74]) -> 0.1 | H74: of:=[.F74]+[.H73] -> 0.1 | I74: of:=IF(ABS([.F74])>1;[.F74]^9;[.F74]) -> 0.1 | J74: of:=[.I74]+[.J73] -> 0.1 | L74: of:=IF(ABS([.F74])>1;[.F74]^9;[.F74]) -> 0.1 | M74: of:=IF(ABS([.F74])>1;[.F74]^9;[.F74]) -> 0.1 | O74: of:=IF(ABS([.F74])>1;[.F74];[.F74]) -> 0.1 | P74: of:=IF(ABS([.F74])>1;[.F74];[.F74]) -> 0.1 | Q74: of:=IF(ABS([.F74])>1;[.F74];[.F74]) -> 0.1 | S74: 1
F75: 1000000000000000 | G75: of:=IF(ABS([.F75])>1;0;[.F75]) -> 0 | H75: of:=[.F75]+[.H74] -> 1E+015 | I75: of:=IF(ABS([.F75])>1;[.F75]^9;[.F75]) -> 1E+135 | J75: of:=[.I75]+[.J74] -> 1E+135 | L75: of:=IF(ABS([.F75])>1;[.F75]^9;[.F75]) -> 1E+135 | M75: of:=IF(ABS([.F75])>1;[.F75]^9;[.F75]) -> 1E+135 | O75: of:=IF(ABS([.F75])>1;[.F75];[.F75]) -> 1000000000000000 | P75: of:=IF(ABS([.F75])>1;[.F75];[.F75]) -> 1000000000000000 | Q75: of:=IF(ABS([.F75])>1;[.F75];[.F75]) -> 1000000000000000 | S75: 1E-015
F76: 0.1 | G76: of:=IF(ABS([.F76])>1;0;[.F76]) -> 0.1 | H76: of:=[.F76]+[.H75] -> 1E+015 | I76: of:=IF(ABS([.F76])>1;[.F76]^9;[.F76]) -> 0.1 | J76: of:=[.I76]+[.J75] -> 1E+135 | L76: of:=IF(ABS([.F76])>1;[.F76]^9;[.F76]) -> 0.1 | M76: of:=IF(ABS([.F76])>1;[.F76]^9;[.F76]) -> 0.1 | O76: of:=IF(ABS([.F76])>1;[.F76];[.F76]) -> 0.1 | P76: of:=IF(ABS([.F76])>1;[.F76];[.F76]) -> 0.1 | Q76: of:=IF(ABS([.F76])>1;[.F76];[.F76]) -> 0.1 | S76: -1000000000000000
F77: -1000000000000000 | G77: of:=IF(ABS([.F77])>1;0;[.F77]) -> 0 | H77: of:=[.F77]+[.H76] -> 0 | I77: of:=IF(ABS([.F77])>1;[.F77]^9;[.F77]) -> -1E+135 | J77: of:=[.I77]+[.J76] -> 0 | L77: of:=IF(ABS([.F77])>1;[.F77]^9;[.F77]) -> -1E+135 | M77: of:=IF(ABS([.F77])>1;[.F77]^9;[.F77]) -> -1E+135 | O77: of:=IF(ABS([.F77])>1;[.F77];[.F77]) -> -1000000000000000 | P77: of:=IF(ABS([.F77])>1;[.F77];[.F77]) -> -1000000000000000 | Q77: of:=IF(ABS([.F77])>1;[.F77];[.F77]) -> -1000000000000000 | S77: -1
F78: 0.1 | G78: of:=IF(ABS([.F78])>1;0;[.F78]) -> 0.1 | H78: of:=[.F78]+[.H77] -> 0.1 | I78: of:=IF(ABS([.F78])>1;[.F78]^9;[.F78]) -> 0.1 | J78: of:=[.I78]+[.J77] -> 0.1 | L78: of:=IF(ABS([.F78])>1;[.F78]^9;[.F78]) -> 0.1 | M78: of:=IF(ABS([.F78])>1;[.F78]^9;[.F78]) -> 0.1 | O78: of:=IF(ABS([.F78])>1;[.F78];[.F78]) -> 0.1 | P78: of:=IF(ABS([.F78])>1;[.F78];[.F78]) -> 0.1 | Q78: of:=IF(ABS([.F78])>1;[.F78];[.F78]) -> 0.1 | S78: 1000000000000000
F79: 1000000000000000 | G79: of:=IF(ABS([.F79])>1;0;[.F79]) -> 0 | H79: of:=[.F79]+[.H78] -> 1E+015 | I79: of:=IF(ABS([.F79])>1;[.F79]^9;[.F79]) -> 1E+135 | J79: of:=[.I79]+[.J78] -> 1E+135 | L79: of:=IF(ABS([.F79])>1;[.F79]^9;[.F79]) -> 1E+135 | M79: of:=IF(ABS([.F79])>1;[.F79]^9;[.F79]) -> 1E+135 | O79: of:=IF(ABS([.F79])>1;[.F79];[.F79]) -> 1000000000000000 | P79: of:=IF(ABS([.F79])>1;[.F79];[.F79]) -> 1000000000000000 | Q79: of:=IF(ABS([.F79])>1;[.F79];[.F79]) -> 1000000000000000 | S79: 1
F80: 0.1 | G80: of:=IF(ABS([.F80])>1;0;[.F80]) -> 0.1 | H80: of:=[.F80]+[.H79] -> 1E+015 | I80: of:=IF(ABS([.F80])>1;[.F80]^9;[.F80]) -> 0.1 | J80: of:=[.I80]+[.J79] -> 1E+135 | L80: of:=IF(ABS([.F80])>1;[.F80]^9;[.F80]) -> 0.1 | M80: of:=IF(ABS([.F80])>1;[.F80]^9;[.F80]) -> 0.1 | O80: of:=IF(ABS([.F80])>1;[.F80];[.F80]) -> 0.1 | P80: of:=IF(ABS([.F80])>1;[.F80];[.F80]) -> 0.1 | Q80: of:=IF(ABS([.F80])>1;[.F80];[.F80]) -> 0.1 | S80: 1E-015
F81: -1000000000000000 | G81: of:=IF(ABS([.F81])>1;0;[.F81]) -> 0 | H81: of:=[.F81]+[.H80] -> 0 | I81: of:=IF(ABS([.F81])>1;[.F81]^9;[.F81]) -> -1E+135 | J81: of:=[.I81]+[.J80] -> 0 | L81: of:=IF(ABS([.F81])>1;[.F81]^9;[.F81]) -> -1E+135 | M81: of:=IF(ABS([.F81])>1;[.F81]^9;[.F81]) -> -1E+135 | O81: of:=IF(ABS([.F81])>1;[.F81];[.F81]) -> -1000000000000000 | P81: of:=IF(ABS([.F81])>1;[.F81];[.F81]) -> -1000000000000000 | Q81: of:=IF(ABS([.F81])>1;[.F81];[.F81]) -> -1000000000000000 | S81: -1000000000000000
F82: 0.1 | G82: of:=IF(ABS([.F82])>1;0;[.F82]) -> 0.1 | H82: of:=[.F82]+[.H81] -> 0.1 | I82: of:=IF(ABS([.F82])>1;[.F82]^9;[.F82]) -> 0.1 | J82: of:=[.I82]+[.J81] -> 0.1 | L82: of:=IF(ABS([.F82])>1;[.F82]^9;[.F82]) -> 0.1 | M82: of:=IF(ABS([.F82])>1;[.F82]^9;[.F82]) -> 0.1 | O82: of:=IF(ABS([.F82])>1;[.F82];[.F82]) -> 0.1 | P82: of:=IF(ABS([.F82])>1;[.F82];[.F82]) -> 0.1 | Q82: of:=IF(ABS([.F82])>1;[.F82];[.F82]) -> 0.1 | S82: -1
F83: 1000000000000000 | G83: of:=IF(ABS([.F83])>1;0;[.F83]) -> 0 | H83: of:=[.F83]+[.H82] -> 1E+015 | I83: of:=IF(ABS([.F83])>1;[.F83]^9;[.F83]) -> 1E+135 | J83: of:=[.I83]+[.J82] -> 1E+135 | L83: of:=IF(ABS([.F83])>1;[.F83]^9;[.F83]) -> 1E+135 | M83: of:=IF(ABS([.F83])>1;[.F83]^9;[.F83]) -> 1E+135 | O83: of:=IF(ABS([.F83])>1;[.F83];[.F83]) -> 1000000000000000 | P83: of:=IF(ABS([.F83])>1;[.F83];[.F83]) -> 1000000000000000 | Q83: of:=IF(ABS([.F83])>1;[.F83];[.F83]) -> 1000000000000000 | S83: 1000000000000000
F84: 0.1 | G84: of:=IF(ABS([.F84])>1;0;[.F84]) -> 0.1 | H84: of:=[.F84]+[.H83] -> 1E+015 | I84: of:=IF(ABS([.F84])>1;[.F84]^9;[.F84]) -> 0.1 | J84: of:=[.I84]+[.J83] -> 1E+135 | L84: of:=IF(ABS([.F84])>1;[.F84]^9;[.F84]) -> 0.1 | M84: of:=IF(ABS([.F84])>1;[.F84]^9;[.F84]) -> 0.1 | O84: of:=IF(ABS([.F84])>1;[.F84];[.F84]) -> 0.1 | P84: of:=IF(ABS([.F84])>1;[.F84];[.F84]) -> 0.1 | Q84: of:=IF(ABS([.F84])>1;[.F84];[.F84]) -> 0.1 | S84: 1
F85: -1000000000000000 | G85: of:=IF(ABS([.F85])>1;0;[.F85]) -> 0 | H85: of:=[.F85]+[.H84] -> 0 | I85: of:=IF(ABS([.F85])>1;[.F85]^9;[.F85]) -> -1E+135 | J85: of:=[.I85]+[.J84] -> 0 | L85: of:=IF(ABS([.F85])>1;[.F85]^9;[.F85]) -> -1E+135 | M85: of:=IF(ABS([.F85])>1;[.F85]^9;[.F85]) -> -1E+135 | O85: of:=IF(ABS([.F85])>1;[.F85];[.F85]) -> -1000000000000000 | P85: of:=IF(ABS([.F85])>1;[.F85];[.F85]) -> -1000000000000000 | Q85: of:=IF(ABS([.F85])>1;[.F85];[.F85]) -> -1000000000000000 | S85: 1E-015
F86: 0.1 | G86: of:=IF(ABS([.F86])>1;0;[.F86]) -> 0.1 | H86: of:=[.F86]+[.H85] -> 0.1 | I86: of:=IF(ABS([.F86])>1;[.F86]^9;[.F86]) -> 0.1 | J86: of:=[.I86]+[.J85] -> 0.1 | L86: of:=IF(ABS([.F86])>1;[.F86]^9;[.F86]) -> 0.1 | M86: of:=IF(ABS([.F86])>1;[.F86]^9;[.F86]) -> 0.1 | O86: of:=IF(ABS([.F86])>1;[.F86];[.F86]) -> 0.1 | P86: of:=IF(ABS([.F86])>1;[.F86];[.F86]) -> 0.1 | Q86: of:=IF(ABS([.F86])>1;[.F86];[.F86]) -> 0.1 | S86: -1000000000000000
F87: 1000000000000000 | G87: of:=IF(ABS([.F87])>1;0;[.F87]) -> 0 | H87: of:=[.F87]+[.H86] -> 1E+015 | I87: of:=IF(ABS([.F87])>1;[.F87]^9;[.F87]) -> 1E+135 | J87: of:=[.I87]+[.J86] -> 1E+135 | L87: of:=IF(ABS([.F87])>1;[.F87]^9;[.F87]) -> 1E+135 | M87: of:=IF(ABS([.F87])>1;[.F87]^9;[.F87]) -> 1E+135 | O87: of:=IF(ABS([.F87])>1;[.F87];[.F87]) -> 1000000000000000 | P87: of:=IF(ABS([.F87])>1;[.F87];[.F87]) -> 1000000000000000 | Q87: of:=IF(ABS([.F87])>1;[.F87];[.F87]) -> 1000000000000000 | S87: -1
A88: FunctionsTest::load() assumes result in A, expected in B, check in C and formula in D | F88: 0.1 | G88: of:=IF(ABS([.F88])>1;0;[.F88]) -> 0.1 | H88: of:=[.F88]+[.H87] -> 1E+015 | I88: of:=IF(ABS([.F88])>1;[.F88]^9;[.F88]) -> 0.1 | J88: of:=[.I88]+[.J87] -> 1E+135 | L88: of:=IF(ABS([.F88])>1;[.F88]^9;[.F88]) -> 0.1 | M88: of:=IF(ABS([.F88])>1;[.F88]^9;[.F88]) -> 0.1 | O88: of:=IF(ABS([.F88])>1;[.F88];[.F88]) -> 0.1 | P88: of:=IF(ABS([.F88])>1;[.F88];[.F88]) -> 0.1 | Q88: of:=IF(ABS([.F88])>1;[.F88];[.F88]) -> 0.1 | S88: 1000000000000000
F89: -1000000000000000 | G89: of:=IF(ABS([.F89])>1;0;[.F89]) -> 0 | H89: of:=[.F89]+[.H88] -> 0 | I89: of:=IF(ABS([.F89])>1;[.F89]^9;[.F89]) -> -1E+135 | J89: of:=[.I89]+[.J88] -> 0 | L89: of:=IF(ABS([.F89])>1;[.F89]^9;[.F89]) -> -1E+135 | M89: of:=IF(ABS([.F89])>1;[.F89]^9;[.F89]) -> -1E+135 | O89: of:=IF(ABS([.F89])>1;[.F89];[.F89]) -> -1000000000000000 | P89: of:=IF(ABS([.F89])>1;[.F89];[.F89]) -> -1000000000000000 | Q89: of:=IF(ABS([.F89])>1;[.F89];[.F89]) -> -1000000000000000 | S89: 1
A90: of:=[.F103] -> 5 | B90: of:=[.F104] -> 5 | C90: of:=[.F106] -> true | D90: of:=[.F105] -> =SUM(F3:F102) | F90: 0.1 | G90: of:=IF(ABS([.F90])>1;0;[.F90]) -> 0.1 | H90: of:=[.F90]+[.H89] -> 0.1 | I90: of:=IF(ABS([.F90])>1;[.F90]^9;[.F90]) -> 0.1 | J90: of:=[.I90]+[.J89] -> 0.1 | L90: of:=IF(ABS([.F90])>1;[.F90]^9;[.F90]) -> 0.1 | M90: of:=IF(ABS([.F90])>1;[.F90]^9;[.F90]) -> 0.1 | O90: of:=IF(ABS([.F90])>1;[.F90];[.F90]) -> 0.1 | P90: of:=IF(ABS([.F90])>1;[.F90];[.F90]) -> 0.1 | Q90: of:=IF(ABS([.F90])>1;[.F90];[.F90]) -> 0.1 | S90: 1E-015
A91: of:=[.G103] -> 5 | B91: of:=[.G104] -> 5 | C91: of:=[.G106] -> true | D91: of:=[.G105] -> =SUM(G3:G102) | F91: 1000000000000000 | G91: of:=IF(ABS([.F91])>1;0;[.F91]) -> 0 | H91: of:=[.F91]+[.H90] -> 1E+015 | I91: of:=IF(ABS([.F91])>1;[.F91]^9;[.F91]) -> 1E+135 | J91: of:=[.I91]+[.J90] -> 1E+135 | L91: of:=IF(ABS([.F91])>1;[.F91]^9;[.F91]) -> 1E+135 | M91: of:=IF(ABS([.F91])>1;[.F91]^9;[.F91]) -> 1E+135 | O91: of:=IF(ABS([.F91])>1;[.F91];[.F91]) -> 1000000000000000 | P91: of:=IF(ABS([.F91])>1;[.F91];[.F91]) -> 1000000000000000 | Q91: of:=IF(ABS([.F91])>1;[.F91];[.F91]) -> 1000000000000000 | S91: -1000000000000000
F92: 0.1 | G92: of:=IF(ABS([.F92])>1;0;[.F92]) -> 0.1 | H92: of:=[.F92]+[.H91] -> 1E+015 | I92: of:=IF(ABS([.F92])>1;[.F92]^9;[.F92]) -> 0.1 | J92: of:=[.I92]+[.J91] -> 1E+135 | L92: of:=IF(ABS([.F92])>1;[.F92]^9;[.F92]) -> 0.1 | M92: of:=IF(ABS([.F92])>1;[.F92]^9;[.F92]) -> 0.1 | O92: of:=IF(ABS([.F92])>1;[.F92];[.F92]) -> 0.1 | P92: of:=IF(ABS([.F92])>1;[.F92];[.F92]) -> 0.1 | Q92: of:=IF(ABS([.F92])>1;[.F92];[.F92]) -> 0.1 | S92: -1
A93: of:=[.I103] -> 5 | B93: of:=[.I104] -> 5 | C93: of:=[.I106] -> true | D93: of:=[.I105] -> =SUM(I3:I102) | F93: -1000000000000000 | G93: of:=IF(ABS([.F93])>1;0;[.F93]) -> 0 | H93: of:=[.F93]+[.H92] -> 0 | I93: of:=IF(ABS([.F93])>1;[.F93]^9;[.F93]) -> -1E+135 | J93: of:=[.I93]+[.J92] -> 0 | L93: of:=IF(ABS([.F93])>1;[.F93]^9;[.F93]) -> -1E+135 | M93: of:=IF(ABS([.F93])>1;[.F93]^9;[.F93]) -> -1E+135 | O93: of:=IF(ABS([.F93])>1;[.F93];[.F93]) -> -1000000000000000 | P93: of:=IF(ABS([.F93])>1;[.F93];[.F93]) -> -1000000000000000 | Q93: of:=IF(ABS([.F93])>1;[.F93];[.F93]) -> -1000000000000000 | S93: 1000000000000000
F94: 0.1 | G94: of:=IF(ABS([.F94])>1;0;[.F94]) -> 0.1 | H94: of:=[.F94]+[.H93] -> 0.1 | I94: of:=IF(ABS([.F94])>1;[.F94]^9;[.F94]) -> 0.1 | J94: of:=[.I94]+[.J93] -> 0.1 | L94: of:=IF(ABS([.F94])>1;[.F94]^9;[.F94]) -> 0.1 | M94: of:=IF(ABS([.F94])>1;[.F94]^9;[.F94]) -> 0.1 | O94: of:=IF(ABS([.F94])>1;[.F94];[.F94]) -> 0.1 | P94: of:=IF(ABS([.F94])>1;[.F94];[.F94]) -> 0.1 | Q94: of:=IF(ABS([.F94])>1;[.F94];[.F94]) -> 0.1 | S94: 1
F95: 1000000000000000 | G95: of:=IF(ABS([.F95])>1;0;[.F95]) -> 0 | H95: of:=[.F95]+[.H94] -> 1E+015 | I95: of:=IF(ABS([.F95])>1;[.F95]^9;[.F95]) -> 1E+135 | J95: of:=[.I95]+[.J94] -> 1E+135 | L95: of:=IF(ABS([.F95])>1;[.F95]^9;[.F95]) -> 1E+135 | M95: of:=IF(ABS([.F95])>1;[.F95]^9;[.F95]) -> 1E+135 | O95: of:=IF(ABS([.F95])>1;[.F95];[.F95]) -> 1000000000000000 | P95: of:=IF(ABS([.F95])>1;[.F95];[.F95]) -> 1000000000000000 | Q95: of:=IF(ABS([.F95])>1;[.F95];[.F95]) -> 1000000000000000 | S95: 1E-015
A96: of:=[.L103] -> 5 | B96: of:=[.L104] -> 5 | C96: of:=[.L106] -> true | D96: of:=[.L105] -> =SUM(L3:L102) | F96: 0.1 | G96: of:=IF(ABS([.F96])>1;0;[.F96]) -> 0.1 | H96: of:=[.F96]+[.H95] -> 1E+015 | I96: of:=IF(ABS([.F96])>1;[.F96]^9;[.F96]) -> 0.1 | J96: of:=[.I96]+[.J95] -> 1E+135 | L96: of:=IF(ABS([.F96])>1;[.F96]^9;[.F96]) -> 0.1 | M96: of:=IF(ABS([.F96])>1;[.F96]^9;[.F96]) -> 0.1 | O96: of:=IF(ABS([.F96])>1;[.F96];[.F96]) -> 0.1 | P96: of:=IF(ABS([.F96])>1;[.F96];[.F96]) -> 0.1 | Q96: of:=IF(ABS([.F96])>1;[.F96];[.F96]) -> 0.1 | S96: -1000000000000000
A97: of:=[.M103] -> 10 | B97: of:=[.M104] -> 10 | C97: of:=[.M106] -> true | D97: of:=[.M105] -> =SUM(L3:M102) | F97: -1000000000000000 | G97: of:=IF(ABS([.F97])>1;0;[.F97]) -> 0 | H97: of:=[.F97]+[.H96] -> 0 | I97: of:=IF(ABS([.F97])>1;[.F97]^9;[.F97]) -> -1E+135 | J97: of:=[.I97]+[.J96] -> 0 | L97: of:=IF(ABS([.F97])>1;[.F97]^9;[.F97]) -> -1E+135 | M97: of:=IF(ABS([.F97])>1;[.F97]^9;[.F97]) -> -1E+135 | O97: of:=IF(ABS([.F97])>1;[.F97];[.F97]) -> -1000000000000000 | P97: of:=IF(ABS([.F97])>1;[.F97];[.F97]) -> -1000000000000000 | Q97: of:=IF(ABS([.F97])>1;[.F97];[.F97]) -> -1000000000000000 | S97: -1
F98: 0.1 | G98: of:=IF(ABS([.F98])>1;0;[.F98]) -> 0.1 | H98: of:=[.F98]+[.H97] -> 0.1 | I98: of:=IF(ABS([.F98])>1;[.F98]^9;[.F98]) -> 0.1 | J98: of:=[.I98]+[.J97] -> 0.1 | L98: of:=IF(ABS([.F98])>1;[.F98]^9;[.F98]) -> 0.1 | M98: of:=IF(ABS([.F98])>1;[.F98]^9;[.F98]) -> 0.1 | O98: of:=IF(ABS([.F98])>1;[.F98];[.F98]) -> 0.1 | P98: of:=IF(ABS([.F98])>1;[.F98];[.F98]) -> 0.1 | Q98: of:=IF(ABS([.F98])>1;[.F98];[.F98]) -> 0.1 | S98: 1000000000000000
A99: of:=[.O103] -> 5 | B99: of:=[.O104] -> 5 | C99: of:=[.O106] -> true | D99: of:=[.O105] -> =SUM(O3:O102) | F99: 1000000000000000 | G99: of:=IF(ABS([.F99])>1;0;[.F99]) -> 0 | H99: of:=[.F99]+[.H98] -> 1E+015 | I99: of:=IF(ABS([.F99])>1;[.F99]^9;[.F99]) -> 1E+135 | J99: of:=[.I99]+[.J98] -> 1E+135 | L99: of:=IF(ABS([.F99])>1;[.F99]^9;[.F99]) -> 1E+135 | M99: of:=IF(ABS([.F99])>1;[.F99]^9;[.F99]) -> 1E+135 | O99: of:=IF(ABS([.F99])>1;[.F99];[.F99]) -> 1000000000000000 | P99: of:=IF(ABS([.F99])>1;[.F99];[.F99]) -> 1000000000000000 | Q99: of:=IF(ABS([.F99])>1;[.F99];[.F99]) -> 1000000000000000 | S99: 1
A100: of:=[.P103] -> 10 | B100: of:=[.P104] -> 10 | C100: of:=[.P106] -> true | D100: of:=[.P105] -> =SUM(O3:P102) | F100: 0.1 | G100: of:=IF(ABS([.F100])>1;0;[.F100]) -> 0.1 | H100: of:=[.F100]+[.H99] -> 1E+015 | I100: of:=IF(ABS([.F100])>1;[.F100]^9;[.F100]) -> 0.1 | J100: of:=[.I100]+[.J99] -> 1E+135 | L100: of:=IF(ABS([.F100])>1;[.F100]^9;[.F100]) -> 0.1 | M100: of:=IF(ABS([.F100])>1;[.F100]^9;[.F100]) -> 0.1 | O100: of:=IF(ABS([.F100])>1;[.F100];[.F100]) -> 0.1 | P100: of:=IF(ABS([.F100])>1;[.F100];[.F100]) -> 0.1 | Q100: of:=IF(ABS([.F100])>1;[.F100];[.F100]) -> 0.1 | S100: 1E-015
A101: of:=[.Q103] -> 15 | B101: of:=[.Q104] -> 15 | C101: of:=[.Q106] -> true | D101: of:=[.Q105] -> =SUM(O3:Q102) | F101: -1000000000000000 | G101: of:=IF(ABS([.F101])>1;0;[.F101]) -> 0 | H101: of:=[.F101]+[.H100] -> 0 | I101: of:=IF(ABS([.F101])>1;[.F101]^9;[.F101]) -> -1E+135 | J101: of:=[.I101]+[.J100] -> 0 | L101: of:=IF(ABS([.F101])>1;[.F101]^9;[.F101]) -> -1E+135 | M101: of:=IF(ABS([.F101])>1;[.F101]^9;[.F101]) -> -1E+135 | O101: of:=IF(ABS([.F101])>1;[.F101];[.F101]) -> -1000000000000000 | P101: of:=IF(ABS([.F101])>1;[.F101];[.F101]) -> -1000000000000000 | Q101: of:=IF(ABS([.F101])>1;[.F101];[.F101]) -> -1000000000000000 | S101: -1000000000000000
F102: 0.1 | G102: of:=IF(ABS([.F102])>1;0;[.F102]) -> 0.1 | H102: of:=[.F102]+[.H101] -> 0.1 | I102: of:=IF(ABS([.F102])>1;[.F102]^9;[.F102]) -> 0.1 | J102: of:=[.I102]+[.J101] -> 0.1 | L102: of:=IF(ABS([.F102])>1;[.F102]^9;[.F102]) -> 0.1 | M102: of:=IF(ABS([.F102])>1;[.F102]^9;[.F102]) -> 0.1 | O102: of:=IF(ABS([.F102])>1;[.F102];[.F102]) -> 0.1 | P102: of:=IF(ABS([.F102])>1;[.F102];[.F102]) -> 0.1 | Q102: of:=IF(ABS([.F102])>1;[.F102];[.F102]) -> 0.1 | S102: -1
A103: RESULT | F103: of:=SUM([.F3:.F102]) -> 5 | G103: of:=SUM([.G3:.G102]) -> 5 | H103: of:=[.H102] -> 0.1 | I103: of:=SUM([.I3:.I102]) -> 5 | J103: of:=[.J102] -> 0.1 | L103: of:=SUM([.L3:.L102]) -> 5 | M103: of:=SUM([.L3:.M102]) -> 10 | O103: of:=SUM([.O3:.O102]) -> 5 | P103: of:=SUM([.O3:.P102]) -> 10 | Q103: of:=SUM([.O3:.Q102]) -> 15 | S103: of:=SUM([.S3:.S102]) -> 1E-015
A104: EXPECTED | F104: 5 | G104: 5 | H104: 5 | I104: 5 | J104: 5 | L104: 5 | M104: 10 | O104: 5 | P104: 10 | Q104: 15 | S104: of:=20*1E-015 -> 0.00000000000002
A105: FORMULA | F105: of:=FORMULA([.F103]) -> =SUM(F3:F102) | G105: of:=FORMULA([.G103]) -> =SUM(G3:G102) | H105: of:=FORMULA([.H103]) -> =H102 | I105: of:=FORMULA([.I103]) -> =SUM(I3:I102) | J105: of:=FORMULA([.J103]) -> =J102 | L105: of:=FORMULA([.L103]) -> =SUM(L3:L102) | M105: of:=FORMULA([.M103]) -> =SUM(L3:M102) | O105: of:=FORMULA([.O103]) -> =SUM(O3:O102) | P105: of:=FORMULA([.P103]) -> =SUM(O3:P102) | Q105: of:=FORMULA([.Q103]) -> =SUM(O3:Q102) | S105: of:=FORMULA([.S103]) -> =SUM(S3:S102)
A106: CHECK | F106: of:=[.F103]=[.F104] -> true | G106: of:=[.G103]=[.G104] -> true | H106: of:=[.H103]=[.H104] -> false | I106: of:=[.I103]=[.I104] -> true | J106: of:=[.J103]=[.J104] -> false | L106: of:=[.L103]=[.L104] -> true | M106: of:=[.M103]=[.M104] -> true | O106: of:=[.O103]=[.O104] -> true | P106: of:=[.P103]=[.P104] -> true | Q106: of:=[.Q103]=[.Q104] -> true | S106: of:=[.S103]=[.S104] -> false
A108: WORKS | C108: of:=AND([.C90:.C101]) -> true